B,I,N,G,O
Planned Parenthood is selling babies,"""I believe in Tradition Marriage with my three ex-wives""",God Will Smite The Abortion Lovers,School Prayer,Obamacare
Benghazi,MORE TAX CUTS,Muslims,Minimum Wage is Evil,Someone insults Trump's Hair
McCain's War Record,Trump gets in a fist fight,Everyone Shakes Hands (Free Space),Family Values,"""America is a Christian Nation"""
We need to invade Iraq again…,Those godless Mexicans,America Needs To Police The World,Gun Control,Americans for Prosperity Commerical
Gay Agenda,ISIS,Obama,Citizens United,Koch Brothers
